{
    "profile_id": "open-android-intelligence-json-es256/1.0",
    "protocol_version": "1.0",
    "canonicalization": "RFC8785-JCS",
    "canonicalization_version": "RFC 8785",
    "text_encoding": "UTF-8",
    "signature_preimage_layout": "domain-prefix-nul-u32be-jcs",
    "signature_domains": [
        "enrollment/app-to-bridge",
        "enrollment/bridge-to-app",
        "control/app-to-bridge",
        "control/bridge-to-app",
        "adapter/adapter-to-bridge",
        "adapter/bridge-to-adapter",
        "key-rotation/app-to-bridge",
        "key-rotation/bridge-to-app",
        "key-rotation/adapter-to-bridge",
        "key-rotation/bridge-to-adapter",
        "migration/bridge",
        "approval/device",
        "ticket/bridge",
        "receipt/device",
        "channel-pop/device",
        "channel-pop/adapter"
    ],
    "digest": "SHA-256",
    "signature": "ES256",
    "curve": "P-256",
    "signature_encoding": "IEEE-P1363-64",
    "signature_low_s": true,
    "base64url_policy": "RFC4648-URLSAFE-NO-PADDING-CANONICAL",
    "timestamp_format": "rfc3339-utc-milliseconds",
    "wire_id_format": "lowercase-uuid-v4",
    "server_id_format": "opaque-server-id",
    "integer_format": "decimal-u64",
    "max_envelope_bytes": "262144",
    "max_clock_skew_seconds": "60",
    "replay_window_size": "1024",
    "key_rotation_grace_seconds": "900",
    "wait_read_max_seconds": "900",
    "channel_ticket_lifetime_seconds": "300",
    "artifact_chunk_min_bytes": "65536",
    "artifact_chunk_default_bytes": "262144",
    "artifact_chunk_max_bytes": "1048576",
    "artifact_max_files_per_message": "4",
    "artifact_max_file_bytes": "26214400",
    "artifact_max_message_bytes": "52428800",
    "artifact_orphan_lifetime_seconds": "86400"
}
